{"schemaVersion":1,"dependencyCacheSnapshotId":"node-min-cache","lockfileHash":"sha256:node-min-lock","proxyConfigurationHash":"sha256:node-min-proxy","imageDigest":"sha256:16e22a550f3863206a3f701448c45f7912c6896a62de43add43bb9c86130c3e2","createdAt":"2026-01-01T00:00:00Z","extensions":{"packages":[{"name":"@fixture/proxy-package","version":"1.0.0","integrity":"sha512-5KmgDFjmVWYxEIDg+CnDlpRDqb98VDXME3TVht4AXUXyTas/G0w+grIkAzzWS/9zleLT/Tumiss2vAqPlrMQyQ=="}]}}
