{"schemaVersion":1,"dependencyCacheSnapshotId":"react-orders-filter-017-cache","lockfileHash":"sha256:b97b25d8519fcf2be36982623d7a6aeb37b9b5d4b58b35cb733d395e0218c72b","proxyConfigurationHash":"sha256:node-min-proxy","imageDigest":"sha256:16e22a550f3863206a3f701448c45f7912c6896a62de43add43bb9c86130c3e2","createdAt":"2026-09-10T00:00:00Z","extensions":{"packages":[{"name":"react","version":"19.1.0","integrity":"sha512-FS+XFBNvn3GTAWq26joslQgWNoFu08F4kl0J4CgdNKADkdSGXQyTCnKteIAJy96Br6YbpEU1LSzV5dYtjMkMDg=="},{"name":"react-dom","version":"19.1.0","integrity":"sha512-Xs1hdnE+DyKgeHJeJznQmYMIBG3TKIHJJT95Q58nHLSrElKlGQqDTR2HQ9fx5CN/Gk6Vh/kupBTDLU11/nDk/g=="},{"name":"scheduler","version":"0.26.0","integrity":"sha512-NlHwttCI/l5gCPR3D1nNXtWABUmBwvZpEQiD4IXSbIDq8BzLIK/7Ir5gTFSGZDUu37K5cMNp0hFtzO38sC7gWA=="}]}}
