{
  "schemaVersion": 1,
  "dependencyCacheSnapshotId": "synthetic-preflight-cache",
  "lockfileHash": "sha256:synthetic-lock",
  "proxyConfigurationHash": "sha256:synthetic-proxy",
  "imageDigest": "sha256:synthetic-image",
  "createdAt": "2026-01-01T00:00:00Z",
  "extensions": {
    "packages": [
      {
        "name": "left-pad",
        "version": "1.3.0",
        "integrity": "sha512-c3ludGhldGljLWxlZnQtcGFk"
      }
    ]
  }
}
